{
  "contract": "MO_R4A_S1R1_CLASSICAL_SOURCE_OPERATOR_PROVENANCE_HARDENING_V1",
  "schemaVersion": 1,
  "milestone": "MO-R4A-S1R1",
  "purpose": "Binds every MO-R4A-S1 source operator to independently reconstructible root, commentary, translation, or explicitly unresolved historical-audit provenance. This is a metadata-only successor binding; it changes no evaluator rule, event identity, market bridge, polarity, magnitude, or execution state.",
  "baseLedgerCanonicalHash": "E8C73059A0F85DCB9A9ACC6945A964FAD6EB0D4A47C0CBBE9F72000B5F5E10C4",
  "witnesses": [
    {
      "witnessId": "TRAILOKYA_DIPIKA_VYAS_1972_ORIGINAL_SCAN",
      "identity": "Trailokya Dipika, Pt. Mithalal Vyas, 1972 original scan",
      "artifactSha256": "1EF82899F8FEC6165E7F0514253EA0BE39D991226F9CD3773C9AF8D829892194",
      "witnessRole": "CONTROLLING_ORIGINAL_1972_PAGE_IMAGE",
      "sourceBytePolicy": "PRIVATE_SOURCE_BYTES_NOT_TRACKED"
    },
    {
      "witnessId": "SARAVALI_RANJAN_SANTHANAM_1983_HELD_PARTIAL",
      "identity": "Saravali of Kalyana Varma, R. Santhanam, Ranjan Publications, First Edition 1983, Volume I",
      "artifactSha256": "3BFD4F7F717798F87B7EFD6FA5A3DE2E28E7E09FC2520F0F05AE12B2E1BF9A58",
      "witnessRole": "HELD_TRANSLATION_VOLUME_WITH_ORIGINAL_SANSKRIT_ROOT",
      "sourceBytePolicy": "HELD_SOURCE_BYTES_NOT_TRACKED"
    },
    {
      "witnessId": "BRIHAT_JATAKA_BHATTOPALA_SANSKRIT_TIKA_HELD_WITNESS",
      "identity": "Brhat Jataka with Srimad Bhatotpala Sanskrit commentary, Sri Harikrishna Nibandh Bhavan, Banaras City; title-page date is intentionally not normalized by S1R1",
      "artifactSha256": "D1D2DD8FA2F6DB2BE1D4DFEE559E6929945AEA57EB24BCF8A4951AD0153FBE4A",
      "witnessRole": "HELD_SANSKRIT_ROOT_AND_BHATTOPALA_COMMENTARY_PAGE_IMAGE",
      "sourceBytePolicy": "HELD_SOURCE_BYTES_NOT_TRACKED",
      "directiveNamed1934WitnessAvailability": "NOT_FOUND_IN_REASONABLE_LOCAL_SOURCE_LOCATIONS"
    },
    {
      "witnessId": "MO_R4A_S1_CENTRAL_SOURCE_AUDIT",
      "identity": "Historical central source-audit record retained only as discovery and audit history",
      "artifactSha256": null,
      "witnessRole": "HISTORICAL_AUDIT_NOT_PRIMARY_SOURCE",
      "sourceBytePolicy": "NOT_A_PRIMARY_WITNESS"
    }
  ],
  "operatorProvenance": [
    {
      "operatorId": "TRAILOKYA_1972_NATURAL_PLANET_CLASS_V1",
      "operatorVersion": "1",
      "sourceStatusBefore": "SOURCE_CLOSED_CATEGORICAL",
      "sourceStatusAfter": "SOURCE_CLOSED_CATEGORICAL",
      "operatorPatch": {
        "sourceLocators": [
          {
            "sourceFamily": "TRAILOKYA_DIPIKA_1972",
            "witnessId": "TRAILOKYA_DIPIKA_VYAS_1972_ORIGINAL_SCAN",
            "witnessRole": "CONTROLLING_ORIGINAL_1972_PAGE_IMAGE",
            "sourceLayer": "TRAILOKYA_1972_ROOT_TEXT_AND_HINDI_COMMENTARY",
            "chapter": "Planet nature and motion conditions",
            "verse": "54-58",
            "printedPage": "13-14",
            "scanPage": "29-30",
            "repositoryReference": "configs/sbc/trailokya/trailokya_1972_planet_nature_conditions_v1.yaml",
            "propositionRole": "DIRECT_SOURCE_RULE",
            "provenanceStatus": "SOURCE_CLOSED_EXACT_PAGE_IMAGE"
          }
        ],
        "provenanceStatus": "SOURCE_CLOSED_WITH_EXISTING_TRAILOKYA_PAGE_LOCK"
      }
    },
    {
      "operatorId": "TRAILOKYA_1972_NATURAL_RELATIONSHIP_V1",
      "operatorVersion": "1",
      "sourceStatusBefore": "SOURCE_CLOSED_EXECUTABLE",
      "sourceStatusAfter": "SOURCE_CLOSED_EXECUTABLE",
      "operatorPatch": {
        "sourceLocators": [
          {
            "sourceFamily": "TRAILOKYA_DIPIKA_1972",
            "witnessId": "TRAILOKYA_DIPIKA_VYAS_1972_ORIGINAL_SCAN",
            "witnessRole": "CONTROLLING_ORIGINAL_1972_PAGE_IMAGE",
            "sourceLayer": "TRAILOKYA_1972_ROOT_TEXT_AND_HINDI_COMMENTARY",
            "chapter": "Vedha source relationship matrix",
            "verse": "168-171",
            "printedPage": "39",
            "scanPage": "55",
            "repositoryReference": "configs/sbc/trailokya/trailokya_1972_vedha_magnitude_v1.yaml",
            "propositionRole": "DIRECT_SOURCE_RULE",
            "provenanceStatus": "SOURCE_CLOSED_EXACT_PAGE_IMAGE"
          }
        ],
        "provenanceStatus": "SOURCE_CLOSED_WITH_EXISTING_TRAILOKYA_PAGE_LOCK"
      }
    },
    {
      "operatorId": "BJ_SARAVALI_TEMPORARY_RELATIONSHIP_V1",
      "operatorVersion": "1",
      "sourceStatusBefore": "SOURCE_CLOSED_EXECUTABLE",
      "sourceStatusAfter": "SOURCE_CLOSED_EXECUTABLE",
      "operatorPatch": {
        "sourceFamily": "BRIHAT_JATAKA_AND_SARAVALI_EXACT_ROOT_CROSS_TEXT",
        "sourceWork": "Brhat Jataka and Saravali",
        "author": "Varahamihira; Kalyana Varma",
        "witnessId": "MULTIPLE_HELD_EXACT_SOURCE_WITNESSES",
        "witnessRole": "MULTI_WITNESS_EXACT_ROOT_BINDING",
        "edition": "Brhat Jataka Sanskrit with Bhatotpala commentary held witness; Saravali R. Santhanam First Edition 1983 held witness",
        "rootOrCommentary": "CROSS_TEXT_CORROBORATION",
        "chapter": "Brhat Jataka II; Saravali 4",
        "verseOrLocator": "Brhat Jataka II.18, printed p.38 / scan p.50; Saravali 4.30, printed p.56 / scan p.60",
        "originalTextOrBoundedExcerptReference": "II.18 gives the temporary-friendly position set; Saravali 4.30 independently records the same bounded friend/enemy partition.",
        "directSourceClaim": "The two-set positional rule is bound to separate exact root-text locators rather than a central-audit summary.",
        "sourceLocators": [
          {
            "sourceFamily": "BRIHAT_JATAKA",
            "witnessId": "BRIHAT_JATAKA_BHATTOPALA_SANSKRIT_TIKA_HELD_WITNESS",
            "witnessRole": "HELD_SANSKRIT_ROOT_AND_BHATTOPALA_COMMENTARY_PAGE_IMAGE",
            "sourceLayer": "BRIHAT_JATAKA_ROOT",
            "chapter": "II",
            "verse": "18",
            "printedPage": "38",
            "scanPage": "50",
            "repositoryReference": "S1R1 witness registry SHA-256 binding; source bytes are not tracked",
            "propositionRole": "TEMPORARY_RELATIONSHIP_ROOT",
            "provenanceStatus": "SOURCE_CLOSED_EXACT_PAGE_IMAGE"
          },
          {
            "sourceFamily": "SARAVALI",
            "witnessId": "SARAVALI_RANJAN_SANTHANAM_1983_HELD_PARTIAL",
            "witnessRole": "HELD_TRANSLATION_VOLUME_WITH_ORIGINAL_SANSKRIT_ROOT",
            "sourceLayer": "SARAVALI_ROOT",
            "chapter": "4",
            "verse": "30",
            "printedPage": "56",
            "scanPage": "60",
            "repositoryReference": "S1R1 witness registry SHA-256 binding; Sanskrit root appears with the held translation",
            "propositionRole": "INDEPENDENT_TEMPORARY_RELATIONSHIP_ROOT",
            "provenanceStatus": "SOURCE_CLOSED_EXACT_PAGE_IMAGE"
          }
        ],
        "provenanceStatus": "SOURCE_CLOSED_MULTI_WITNESS_ROOT_BINDING"
      }
    },
    {
      "operatorId": "BJ_SARAVALI_COMPOUND_RELATIONSHIP_V1",
      "operatorVersion": "1",
      "sourceStatusBefore": "SOURCE_CLOSED_EXECUTABLE",
      "sourceStatusAfter": "SOURCE_CLOSED_EXECUTABLE",
      "operatorPatch": {
        "sourceFamily": "BHATTOPALA_COMMENTARY_AND_SARAVALI_ROOT_CROSS_TEXT",
        "sourceWork": "Bhatotpala commentary to Brhat Jataka and Saravali",
        "author": "Bhatotpala; Kalyana Varma",
        "witnessId": "MULTIPLE_HELD_EXACT_SOURCE_WITNESSES",
        "witnessRole": "ROOT_AND_COMMENTARY_LAYERS_EXPLICITLY_SEPARATED",
        "edition": "Brhat Jataka Sanskrit with Bhatotpala commentary held witness; Saravali R. Santhanam First Edition 1983 held witness",
        "rootOrCommentary": "CROSS_TEXT_CORROBORATION",
        "chapter": "Brhat Jataka II commentary; Saravali 4",
        "verseOrLocator": "Bhatotpala commentary following Brhat Jataka II.18, printed p.38 / scan p.50; Saravali 4.31, printed p.57 / scan p.61",
        "originalTextOrBoundedExcerptReference": "The Brhat Jataka root supplies the temporary partition; its following commentary is retained as commentary-only evidence, while Saravali 4.31 directly supplies the five-state composition.",
        "directSourceClaim": "The five-state categorical table is root-bound to Saravali 4.31 and does not misattribute Bhatotpala commentary to Varahamihira's root.",
        "crossTextSupport": [
          "BHATTOPALA_COMMENTARY",
          "SARAVALI_ROOT"
        ],
        "sourceLocators": [
          {
            "sourceFamily": "BRIHAT_JATAKA_BHATTOPALA_COMMENTARY",
            "witnessId": "BRIHAT_JATAKA_BHATTOPALA_SANSKRIT_TIKA_HELD_WITNESS",
            "witnessRole": "HELD_SANSKRIT_ROOT_AND_BHATTOPALA_COMMENTARY_PAGE_IMAGE",
            "sourceLayer": "BHATTOPALA_COMMENTARY",
            "chapter": "II",
            "verse": "commentary following 18",
            "printedPage": "38",
            "scanPage": "50",
            "repositoryReference": "S1R1 witness registry SHA-256 binding; source bytes are not tracked",
            "propositionRole": "COMPOUND_RELATIONSHIP_COMMENTARY_EXPLANATION",
            "provenanceStatus": "SOURCE_CLOSED_EXACT_PAGE_IMAGE"
          },
          {
            "sourceFamily": "SARAVALI",
            "witnessId": "SARAVALI_RANJAN_SANTHANAM_1983_HELD_PARTIAL",
            "witnessRole": "HELD_TRANSLATION_VOLUME_WITH_ORIGINAL_SANSKRIT_ROOT",
            "sourceLayer": "SARAVALI_ROOT",
            "chapter": "4",
            "verse": "31",
            "printedPage": "57",
            "scanPage": "61",
            "repositoryReference": "S1R1 witness registry SHA-256 binding; Sanskrit root appears with the held translation",
            "propositionRole": "COMPOUND_RELATIONSHIP_ROOT",
            "provenanceStatus": "SOURCE_CLOSED_EXACT_PAGE_IMAGE"
          }
        ],
        "provenanceStatus": "SOURCE_CLOSED_ROOT_AND_COMMENTARY_BOUNDARY_EXPLICIT"
      }
    },
    {
      "operatorId": "SARAVALI_4_32_ORDINARY_DRSTI_V1",